{
  "schemaVersion": "0.3.0",
  "reportId": "efficacy-report:template_unrun",
  "state": "template_inert",
  "ownerRepositoryId": "repo:template_target",
  "authority": {
    "grantsAuthority": false,
    "grantsMutation": false,
    "grantsPromotion": false,
    "grantsPublication": false
  },
  "plan": { "id": "efficacy-plan:template_unmeasured", "path": "templates/adoption-efficacy-plan.template.json", "sha256": "1111111111111111111111111111111111111111111111111111111111111111", "schemaVersion": "0.3.0" },
  "protocolBundle": { "id": "protocol:elad_0.3.0", "path": "blueprint.json", "sha256": "0000000000000000000000000000000000000000000000000000000000000000", "schemaVersion": "0.3.0" },
  "candidateAdoptionIdentity": {
    "projectProfile": { "id": "project:template_target", "path": "templates/project-profile.template.json", "sha256": "2222222222222222222222222222222222222222222222222222222222222222", "schemaVersion": "0.3.0" },
    "activeAuthority": { "id": "authority:template_held", "path": "templates/active-authority.template.json", "sha256": "3333333333333333333333333333333333333333333333333333333333333333", "schemaVersion": "0.3.0" },
    "writerProfiles": [],
    "certificates": [],
    "qualificationScopeIds": []
  },
  "candidateObservations": [],
  "recomputedBaselineAggregates": [],
  "candidateAggregates": [],
  "metricResults": [],
  "guardrailResults": [],
  "decision": "hold",
  "requiredActions": [
    "Freeze a target-owned baseline and collect complete observations before any maturity activation."
  ],
  "evidenceManifest": { "id": "evidence-manifest:template_unrun", "path": "templates/evidence-manifest.template.json", "sha256": "4444444444444444444444444444444444444444444444444444444444444444", "schemaVersion": "0.3.0" },
  "independentVerification": null,
  "startedAt": null,
  "completedAt": null,
  "supersedes": null
}
